<?xml version="1.0" encoding="utf-8" ?>
<CodeGenerator xmlns:xsi="http://www.w3.org/2001/XMLSchema-instance"
		 xsi:noNamespaceSchemaLocation="../../KomberNet.Models.CodeGenerator/Structure/CodeGeneratorSchema.xsd">
	<Entity Namespace="KomberNet.Models.Organization" Name="OrganizationGroup" PluralName="OrganizationGroups">
		<EntityFields>
			<KeyField Name="OrganizationGroupId"/>
			<StringField Name="Name" MaxLength="255" IsRequired="true"/>
		</EntityFields>
		
		<GenerateEntityHandlerRequest />
		<GenerateEntityQueryRequest />
		<GenerateEntitiesQueryRequest />
	</Entity>
</CodeGenerator>